{
  "schema_version": "corpus_source_queue_v1",
  "queue_id": "mystery-corpus-expansion-v0.2",
  "created_date": "2026-09-23",
  "purpose": "Controlled expansion candidates for Mystery Corpus M2. Ready sources are analysis-only unless explicit full-text rights are verified. Candidate fiction remains blocked until individual rights verification.",
  "items": [
    {
      "source_id": "fbi-9-11-investigation",
      "title": "9/11 Investigation",
      "creator": null,
      "source_family": "fbi_history",
      "source_type": "real_case",
      "source_reference": "https://www.fbi.gov/history/cases-and-criminals",
      "source_locator": "9/11 Investigation",
      "jurisdiction": "US",
      "year": null,
      "rights_status": "government_public_record",
      "ingestion_policy": "metadata_and_analysis_only",
      "raw_text_retained": false,
      "priority": "P2",
      "status": "rights_verified",
      "target_pattern_tags": [],
      "notes": "Discovered from FBI Cases and Criminals index. Abstract factual/investigation analysis only; no source-text retention.",
      "rights_evidence_reference": "https://www.fbi.gov/history/cases-and-criminals",
      "rights_verified_date": "2026-09-23"
    },
    {
      "source_id": "fbi-abscam",
      "title": "ABSCAM",
      "creator": null,
      "source_family": "fbi_history",
      "source_type": "real_case",
      "source_reference": "https://www.fbi.gov/history/cases-and-criminals",
      "source_locator": "ABSCAM",
      "jurisdiction": "US",
      "year": null,
      "rights_status": "government_public_record",
      "ingestion_policy": "metadata_and_analysis_only",
      "raw_text_retained": false,
      "priority": "P1",
      "status": "rights_verified",
      "target_pattern_tags": [
        "undercover",
        "public-corruption",
        "inducement",
        "recorded-evidence"
      ],
      "notes": "FBI history index states its case monographs/write-ups are available for non-commercial use; corpus use is limited to factual metadata/abstract analysis, with no source-text republication.",
      "rights_evidence_reference": "https://www.fbi.gov/history/cases-and-criminals",
      "rights_verified_date": "2026-09-23"
    },
    {
      "source_id": "fbi-al-capone",
      "title": "Al Capone",
      "creator": null,
      "source_family": "fbi_history",
      "source_type": "real_case",
      "source_reference": "https://www.fbi.gov/history/cases-and-criminals",
      "source_locator": "Al Capone",
      "jurisdiction": "US",
      "year": null,
      "rights_status": "government_public_record",
      "ingestion_policy": "metadata_and_analysis_only",
      "raw_text_retained": false,
      "priority": "P2",
      "status": "rights_verified",
      "target_pattern_tags": [],
      "notes": "Discovered from FBI Cases and Criminals index. Abstract factual/investigation analysis only; no source-text retention.",
      "rights_evidence_reference": "https://www.fbi.gov/history/cases-and-criminals",
      "rights_verified_date": "2026-09-23"
    },
    {
      "source_id": "fbi-alcatraz-escape",
      "title": "Alcatraz Escape",
      "creator": null,
      "source_family": "fbi_history",
      "source_type": "real_case",
      "source_reference": "https://www.fbi.gov/history/cases-and-criminals",
      "source_locator": "Alcatraz Escape",
      "jurisdiction": "US",
      "year": null,
      "rights_status": "government_public_record",
      "ingestion_policy": "metadata_and_analysis_only",
      "raw_text_retained": false,
      "priority": "P1",
      "status": "rights_verified",
      "target_pattern_tags": [
        "escape",
        "physical-reconstruction",
        "uncertainty",
        "trace-evidence"
      ],
      "notes": "FBI history index states its case monographs/write-ups are available for non-commercial use; corpus use is limited to factual metadata/abstract analysis, with no source-text republication.",
      "rights_evidence_reference": "https://www.fbi.gov/history/cases-and-criminals",
      "rights_verified_date": "2026-09-23"
    },
    {
      "source_id": "fbi-aldrich-ames",
      "title": "Aldrich Ames",
      "creator": null,
      "source_family": "fbi_history",
      "source_type": "real_case",
      "source_reference": "https://www.fbi.gov/history/cases-and-criminals",
      "source_locator": "Aldrich Ames",
      "jurisdiction": "US",
      "year": null,
      "rights_status": "government_public_record",
      "ingestion_policy": "metadata_and_analysis_only",
      "raw_text_retained": false,
      "priority": "P1",
      "status": "rights_verified",
      "target_pattern_tags": [
        "espionage",
        "financial-anomaly",
        "counterintelligence",
        "behavioral-pattern"
      ],
      "notes": "FBI history index states its case monographs/write-ups are available for non-commercial use; corpus use is limited to factual metadata/abstract analysis, with no source-text republication.",
      "rights_evidence_reference": "https://www.fbi.gov/history/cases-and-criminals",
      "rights_verified_date": "2026-09-23"
    },
    {
      "source_id": "fbi-alger-hiss",
      "title": "Alger Hiss",
      "creator": null,
      "source_family": "fbi_history",
      "source_type": "real_case",
      "source_reference": "https://www.fbi.gov/history/cases-and-criminals",
      "source_locator": "Alger Hiss",
      "jurisdiction": "US",
      "year": null,
      "rights_status": "government_public_record",
      "ingestion_policy": "metadata_and_analysis_only",
      "raw_text_retained": false,
      "priority": "P2",
      "status": "rights_verified",
      "target_pattern_tags": [],
      "notes": "Discovered from FBI Cases and Criminals index. Abstract factual/investigation analysis only; no source-text retention.",
      "rights_evidence_reference": "https://www.fbi.gov/history/cases-and-criminals",
      "rights_verified_date": "2026-09-23"
    },
    {
      "source_id": "fbi-amerithrax",
      "title": "Amerithrax / Anthrax Investigation",
      "creator": null,
      "source_family": "fbi_history",
      "source_type": "real_case",
      "source_reference": "https://www.fbi.gov/history/cases-and-criminals",
      "source_locator": "Amerithrax / Anthrax Investigation",
      "jurisdiction": "US",
      "year": null,
      "rights_status": "government_public_record",
      "ingestion_policy": "metadata_and_analysis_only",
      "raw_text_retained": false,
      "priority": "P1",
      "status": "rights_verified",
      "target_pattern_tags": [
        "forensics",
        "mail-trace",
        "scientific-evidence",
        "hypothesis-elimination"
      ],
      "notes": "FBI history index states its case monographs/write-ups are available for non-commercial use; corpus use is limited to factual metadata/abstract analysis, with no source-text republication.",
      "rights_evidence_reference": "https://www.fbi.gov/history/cases-and-criminals",
      "rights_verified_date": "2026-09-23"
    },
    {
      "source_id": "fbi-ana-montes",
      "title": "Ana Montes",
      "creator": null,
      "source_family": "fbi_history",
      "source_type": "real_case",
      "source_reference": "https://www.fbi.gov/history/cases-and-criminals",
      "source_locator": "Ana Montes",
      "jurisdiction": "US",
      "year": null,
      "rights_status": "government_public_record",
      "ingestion_policy": "metadata_and_analysis_only",
      "raw_text_retained": false,
      "priority": "P1",
      "status": "rights_verified",
      "target_pattern_tags": [
        "espionage",
        "communications",
        "counterintelligence",
        "pattern-analysis"
      ],
      "notes": "FBI history index states its case monographs/write-ups are available for non-commercial use; corpus use is limited to factual metadata/abstract analysis, with no source-text republication.",
      "rights_evidence_reference": "https://www.fbi.gov/history/cases-and-criminals",
      "rights_verified_date": "2026-09-23"
    },
    {
      "source_id": "fbi-rosenbergs",
      "title": "Atom Spy Case / Rosenbergs",
      "creator": null,
      "source_family": "fbi_history",
      "source_type": "real_case",
      "source_reference": "https://www.fbi.gov/history/cases-and-criminals",
      "source_locator": "Atom Spy Case / Rosenbergs",
      "jurisdiction": "US",
      "year": null,
      "rights_status": "government_public_record",
      "ingestion_policy": "metadata_and_analysis_only",
      "raw_text_retained": false,
      "priority": "P1",
      "status": "rights_verified",
      "target_pattern_tags": [
        "espionage",
        "network",
        "documentary-evidence",
        "corroboration"
      ],
      "notes": "FBI history index states its case monographs/write-ups are available for non-commercial use; corpus use is limited to factual metadata/abstract analysis, with no source-text republication.",
      "rights_evidence_reference": "https://www.fbi.gov/history/cases-and-criminals",
      "rights_verified_date": "2026-09-23"
    },
    {
      "source_id": "fbi-baptist-street-church-bombing",
      "title": "Baptist Street Church Bombing",
      "creator": null,
      "source_family": "fbi_history",
      "source_type": "real_case",
      "source_reference": "https://www.fbi.gov/history/cases-and-criminals",
      "source_locator": "Baptist Street Church Bombing",
      "jurisdiction": "US",
      "year": null,
      "rights_status": "government_public_record",
      "ingestion_policy": "metadata_and_analysis_only",
      "raw_text_retained": false,
      "priority": "P2",
      "status": "rights_verified",
      "target_pattern_tags": [],
      "notes": "Discovered from FBI Cases and Criminals index. Abstract factual/investigation analysis only; no source-text retention.",
      "rights_evidence_reference": "https://www.fbi.gov/history/cases-and-criminals",
      "rights_verified_date": "2026-09-23"
    },
    {